created_at,full_text
2025-09-09 17:05:04+00:00,"Tiap liat dia ngomong, firasat gua gak enak bgt. Wallahi, gua masih gak percaya Menkeu yg gantiin SRI MULYANI modelan bgini ya Allah."
2025-09-09 17:34:42+00:00,"Hati hati bos kalau ngomong, kok suka nyakitin rakyat !!"
2025-09-09 15:56:28+00:00,"gak ada yg plintir…pantes lulusan kampus gak terkenal…(“,)"
2025-09-09 13:49:57+00:00,"""MASIH ADAPTASI"""
2025-09-09 16:37:23+00:00,Ditunggu pertumbuhan 6%-7%nya bang jago
2025-09-09 13:07:26+00:00,Day 2 menjadi menteri
2025-09-09 17:23:55+00:00,"Reshuffle bukannya ganti menteri yang lebih bagus, malah makin ancur.  Please Wok, stop balas budi biar bisa pilih orang yg bener, yg sesuai kompetensinya."
2025-09-09 11:13:15+00:00,"Sah ni jadi mentri kabinet pororo, blunder terus minta maaf tapi ga tulus"
2025-09-09 13:14:15+00:00,belom 24 jam udah blunder terus minta maaf  banyak ngeles.  ancur cok keuangan negara  hal sederhana disepelekan.  Ready to badai PHK 2026 (3 bulan lagi)
2025-09-09 15:09:08+00:00,publik speakingnya seriuz gini??..
2025-09-09 23:12:15+00:00,"saran aja pak wowo, kabinetnya diganti jadi kabinet asbun aja. capek liat pejabat ngomong kek orang gak bisa mikir dari dulu."
2025-09-09 16:03:11+00:00,"Baru sehari menjabat sdh menunjukkan karakter kebanyakan pejabat RI: angkuh, merasa paling tahu dan paling pintar krn punya jabatan. Di mana2, orang baru adabtasi itu justru lebih banyak mendengarkan, bertanya, dan belajar, bukan malah memamerkan kebodohan."
2025-09-09 13:34:01+00:00,"Stop jadiin anomali"" sebagai pejabat pemerintahan!!! Jelek bgt kualifikasinya"
2025-09-09 11:26:39+00:00,((mungkin))
2025-09-09 12:58:21+00:00,baru sehari tampaknya dia sudah cukup lelah
2025-09-09 11:38:42+00:00,Haha tetep nirempati.
2025-09-09 13:29:10+00:00,New Minister Syndrome?
2025-09-10 05:17:36+00:00,minta maaf gak buat kamu hina tapi lek bolak balik minta maaf op jenenge
2025-09-09 21:48:28+00:00,"Bukan kalimat orang minta maaf, hanya kalimat pejabat pidato sepetti biasa."
2025-09-09 15:38:42+00:00,プルバヤ財務大臣「17+8の要求は国民のごく一部から出たもの」と述べたことに対し謝罪。早で草(3)
2025-09-09 17:37:43+00:00,ketoe koe kabotan jeneng.. mumet sebelum bertanding
2025-09-09 11:17:47+00:00,Noted !
2025-09-09 12:50:17+00:00,"Cengengas cengenges... Ingat kalian itu cuma pelayanan masyarakat , layani tuanmu dengan baik"
2025-09-09 16:47:35+00:00,Semangatsss
2025-09-09 11:38:10+00:00,muka ngomongnya minta ditonjok
2025-09-09 16:51:14+00:00,Doesn’t matter. Everybody knows your true colors already.
2025-09-01 00:33:35+00:00,"i really love how #ResetIndonesia use pink and green as the main color of this people movement  for the mighty mother who bravely fight the police with all the protesters, and  for Affan who lost his life in the hand of the police and one of the reason why we keep marching"
2025-09-02 02:25:00+00:00,ada versi englishnya gak sih? mau gue retweet di akun sebelah karna audiencenya non-ina banyakan
2025-08-31 16:37:36+00:00,UPPPPP!!!!
2025-09-01 12:55:43+00:00,關於印尼 Ps.粉紅+綠很好看 我幾愛印尼傳統音樂和batik 希望他們reset 成功 今天window 推我印尼烏布 會的，下年見
2025-09-01 15:29:43+00:00,7+8 TUNTUTAN UNTUK RAKYAT
2025-09-01 01:10:59+00:00,25 tuntutan rakyat
2025-09-02 05:35:42+00:00,"Karena rame, mau up ini lagii"
2025-09-02 08:06:53+00:00,nurut dong cepatt!!! klo bisa sebelum tanggal 5 yahh... gue mau balik ke crbn!! @ pemrinthh #ResetIndonesia
2025-09-01 04:08:15+00:00,"Ojol salah satu elemen terbesar demo, but they don't even put tuntutan Koalisi Ojol Nasional (KON) into consideration. I don't think Afu dkk know ojol punya serikat. Inilah kenapa yapping soal syarat toefl+s2 dewan PERWAKILAN itu tolol. Look how unrepresentative this is."
2025-09-01 00:23:20+00:00,my birthday wish? 17 + 8 tuntutan rakyat terwujud aja #ResetIndonesia
2025-09-01 07:35:16+00:00,Ayo gais di sebarin
2025-09-02 13:56:31+00:00,͏
2025-08-31 20:23:52+00:00,"aku mungkin agak ngantuk, tapi di mana UU pemilu, padahal itu salah satu yg paling krusial utk jangka panjang? elit hanya akan saling tukeran shift kalau UU pemilu gak direvisi. ini juga jadi tuntutan aksi buruh kemarin"
2025-08-31 23:59:21+00:00,IQRA  @prabowo   @DPR_RI
2025-08-31 20:00:08+00:00,Hi there! I don't know if anyone has replied to you anymore but your concerns is valid. Kindly refer to this link for information. It's not disbandment - it's reformation. We need representatives that actually cares for their people. Stay safe!
2025-09-01 17:54:07+00:00,key poins from #ResetIndonesia are  source : 1.  https:// x.com/barengwarga/st atus/1962340481154920732?t=RF61ALp6mB7YfK3AoBEeCA&s=19 … 2.
2025-09-02 02:50:55+00:00,Kawalll terusss!!!!
2025-08-31 23:35:09+00:00,"17+8 tuntutan rakyat, what a familiar numbers. semoga kita juga bisa ""merdeka""  #ResetIndonesia"
2025-08-31 17:52:40+00:00,tuntutan gaib
2025-09-01 07:02:35+00:00,"oot, mau makasih ke siapapun yg milihin perpaduan warna ijo pink ini BAGUS bgt please"
2025-09-01 02:03:56+00:00,KAWAL TERUUSS!!
2025-09-02 12:47:32+00:00,"Tuntutan2 belum menyentuh pondasi utama yg fundamental dr kesalahan sistem negara ini.   Lo ga bs hanya berharap pada moral value seseorang, atau sekelompok.. lo harus mengganti sistemnya agar akuntable mengawasi org dan kelompok itu.."
2025-09-01 08:11:13+00:00,Ayo duluan mana nih?  @mecimapro  melani kelarin refund 5 miliar atau wowo menuhin tuntutan rakyat?
2025-08-31 17:02:31+00:00,DPR tolol gamalu apa lu ini liat masyarakat aja jauh lebih kompeten drpd kalian anjirrrrrrrrrr bloon
2025-09-01 12:31:57+00:00,"Titipan agenda color revolution ala SJW NGO LSM LBH penerima dana Soros Open society, Ford Foundation, NED, USAID."
2025-09-01 19:20:48+00:00,"Menurut gua ada satu tuntutan lagi yg harus ditambah: pendidikan gratis & merata dari dasar sampai tinggi, plus sistemnya dirubah. Kurikulum Madilog wajib diterapkan biar generasi kita kritis & siap bangun Indonesia."
2025-09-01 06:37:52+00:00,RESET!
2025-08-31 22:46:55+00:00,Wowo mana mampu
2025-08-31 17:36:30+00:00,"banyak nih pr lu pada, kerjain ayam."
2025-08-31 22:16:38+00:00,temen temen bisa dibaca yaa biar bisa ikut kawal tuntutan kita!!!
2025-09-01 00:55:06+00:00,"Kurang dimanja apa lagi, rakyat sampe ngedikte pemerintah apa aja yang harus dikerjakan SECARA SUKARELA ketika yang di atas dapet tunjangan ratusan juta? Bener-bener puncak komedi. Tapi ya, tetap fokus pada tuntutannya. #ResetIndonesia"
2025-09-02 10:38:11+00:00,http:// tuntutanwarga.net
2025-08-31 20:59:20+00:00,Bakal didengar atau minimal dicatat? Tentu tidaaak
2025-08-31 17:05:05+00:00,MA @adelinaaa25 · 1 Sep Kutipan Aurelia V @senjatanuklir · 31 Agt 7+8 Tuntutan Rakyat dalam seminggu dan setahun (dengan deadline). #ResetIndonesia  110
2025-09-01 15:49:31+00:00,terus bersuara yaa semua
2025-09-01 05:27:49+00:00,ayookkk baca2 tmn2
2025-09-01 14:00:01+00:00,͏ ͏͏ ͏͏ ͏͏ ͏
2025-09-01 03:47:17+00:00,buset ini mah lebih jelas drpd revisian skripsi
2025-08-31 23:37:39+00:00,"Udah sampe bikin rangkuman kayak gini rakyatnya, seharusnya mereka gk akan bingung mau ngapain kan buat nyelesain ini kalo sampe gk dilakuin emg dungunya gk ketolong  #ResetIndonesia"
2025-09-01 03:09:57+00:00,is this really too much too ask?  waking up feels so heavy this past week krn lgsg baca berita and none of it were good. praying for this country is just getting harder my heart breaks every damn time
2025-09-01 16:29:02+00:00,17+8 tuntutan rakyat #ResetIndonesia
2025-08-31 22:41:28+00:00,"Wih makasih Kak Aurelia.  Rakyat tuh atasannya presiden kan yak? nah udeh dibikin nih  @prabowo , kalo udeh baca reply dgn ""noted"" yak. trs kerjain dah tuh met begadang ampe deadline."
2025-09-01 02:53:58+00:00,THIS
2025-09-03 15:20:04+00:00,AWAS!!!! PENGALIHAN ISU TETEP KAWAL
2025-08-31 17:05:26+00:00,春の雨 @fauzaanatmaja · 1 Sep Kutipan Aurelia V @senjatanuklir · 31 Agt 7+8 Tuntutan Rakyat dalam seminggu dan setahun (dengan deadline). #ResetIndonesia  81
2025-09-01 03:49:16+00:00,Tbh i think we should demand early parliamentary election  Create new parties and track down on corrupt members
2025-09-02 02:22:35+00:00,"Please take actions and be responsive towards this issue, Bapak  @prabowo  yang terhormat, also  @DPR_RI . Show that you actually carry your responsibility and accountability."
2025-08-31 17:05:47+00:00,GUYS LET’S GO KAWAL 17+8 SAMPE TUNTAS
2025-08-31 21:57:57+00:00,"hasil diskusi 3 jam by call, budget Rp 0  harusnya yg mewakili rakyat tuh yg ada isinya begini, bukan yg kerjanya nyari isi perut muluk"
2025-09-01 13:31:36+00:00,17+8 TUNTUTAN RAKYAT! Udah patuh nih buat kondusif sejak hari ini meskipun banyak jebakan batman (dari kalian juga). Sekarang udah saatnya kalian yang PATUH sama tuntutan kita semua.
2025-09-01 03:05:35+00:00,"kalo sampe tuntutan ini sampe di acc dan di laksanakan, aku Do'akan pemerintah dan para pejabat nya sehat dan panjang umur."
2025-09-02 12:02:16+00:00,"postingan ini ada di ig gak sih, mw post ke story ih"
2025-09-01 09:02:02+00:00,"Eskalasi kebijakan yg progresif tapi juga berlandaskan substansi konteks isu sosial & berpihak ke rakyat dari eksekutif, kontrol penuh dgn kepekaan sosial & landasan UUD yg proper. Legislatif juga hrs aktif sbg Check&Balance dlm iklim demokrasi & serius perjuangkan UU yg berpihak"
2025-09-01 11:04:44+00:00,Guys!!
2025-09-01 05:53:35+00:00,BACAAAAAA ORANG BERPENDIDIKAN KAN?!!  Mau tetep di jabatan kan?!  @prabowo   @puanmaharani_ri   @gibran_tweet   @ListyoSigitP   #BubarkanDPR #IndonesiaGelap #PolriMusuhBersama #POLISIPEMBUNUH
2025-08-31 18:33:32+00:00,"PR nya udah dibreakdown, trus dibikin checklist poin-poin. Kurang enak apa bjir"
2025-09-01 11:54:31+00:00,"@prabowo  ndut ini pisang nya udah dikupasin dan disuapin, lu tinggal ngunyah dan nelen aja ndut. masih ga bisa juga? ini bukan ujian open book lagi ndut, jawabannya udah didiktein langsung ama dosennya ndut, lu tinggal tulis, masih ga bisa jugaa?"
2025-09-01 00:06:48+00:00,"Tambahan 1. Batalkan pajak yang mencekik rakyat 2. Turunkan gaji dan tunjangan DPR hingga di batas wajar serta audit anggaran Triliuan DPR, termasuk hapus perjalanan dinas luar negeri DPR serta pensiunan DPR (mereka kan kerja cuma 5 tahun kenapa dikasih dana pensiun? Beban)"
2025-09-01 10:39:39+00:00,Pemerintah!!!  Tolong dengarkan 7+8 Tuntutan Rakyat dalam seminggu dan setahun  #ResetIndonesia
2025-09-01 03:32:55+00:00,enak banget nih udah dibreakdown sama rakyatnya
2025-09-01 03:16:14+00:00,"udah di breakdown ama rakyat, bahkan mereka bahas ini cuman via telepon WA"
2025-08-31 19:03:02+00:00,BUKTIKANNNNNNN !!!
2025-08-31 20:16:34+00:00,enak banget nih udah dibreakdown sama rakyatnya. plis ya dibaca! kalo sampe ga ngerti juga sih keterlaluan dah lu pada yang di pemerintahan.  #ResetIndonesia
2025-09-01 02:29:55+00:00,ladang ceklis
2025-09-01 15:29:25+00:00,Bantu share sebanyak-banyaknya guys. Kalo masih ada yg nanya ngapain demo kita sodorin ini kalo masih ga paham juga mending suruh sekolah lagi #ResetIndonesia
2025-09-02 08:24:41+00:00,okay what if ini gk dilaksanakan sama government dan still tone deaf???? apa tindakan kita selanjutnya??
2025-08-31 16:56:37+00:00,Ini baru namanya perwakilan rakyat ga malu tuh yg katanya DPR
2025-09-01 01:52:04+00:00,"Kalau Govt dan DPR masih bingung aha mau ngapain, ini listnya lengkap dari tujuan sampai caranya.  Bukan pidato atau konpers yang isinya ""akan"", ""akan"", ""menghimbau"", dan berdiksi buram. Udah sejelas ini gak dipenuhi mah kebangetan di-carry-nya."
2025-09-01 07:48:27+00:00,iqro  @prabowo
2025-09-01 00:58:53+00:00,"Nah ini saya dukung, bukan tuntutan BEM SI lokal fasis yang probably psyop juga lagi momen ginian malah poinnya pingin persekusi minoritas. YES, BENERAN. Dasarnya ya nilai timur dan agam4 lagi, bedanya ama pertahana apaan monyet"
2025-08-31 22:35:07+00:00,"tuntutan2 yg dicantumkan oleh rekan kerja Ferry Irwandi di ""Malaka Project"" yaitu saudari Aurelia Vizal  @senjatanuklir   . Anehnya rekan2 kerjanya yang jelas2 aktif dalam mengajak & mengkoordinasi demo tidak disebut oleh Ferry Irwandi sebagai dalang demo."
2025-09-01 01:37:14+00:00,baca guys
2025-09-02 03:54:32+00:00,Untuk sektor anti-korup. PENGUATAN INDEPENDENSI KPK dulu baru penguatan UU tipikor dan UU perampasan aset.
2025-08-31 18:48:32+00:00,"Bantu amplifikasi semua, share sebanyaknya. Saatnya yg muda2 aja yg ambil alih"
2025-08-31 17:10:49+00:00,"TOLONGGGGGGG. BUKA MATA, BUKA TELINGA. JANGAN BUDEG  @prabowo   @DPR_RI"
2025-08-31 19:11:02+00:00,"Wkwkwkwkwk... mana mau mereka merealisasikan tuntutan kek gini. Ini mah sama aja kampanye ""perubahan"" Anies Baswedan dlu   Ntar bisa2 muncul tuntutan batalkan program MBG, pembangunan IKN dan proyek perpanjangan jalur kereta Whoosh. Mau ditaro dimana muka presiden"
2025-09-01 07:08:46+00:00,"apa gue print ini yaa?!?? barusan emak2 tetangga gue ngoceh2 kek orang tolol, malah bilang 'yg demo ga jelas, maen bakar ini itu' 'orang mah jelas tuntutannya apa? tujuannya ke siapa?', efek stasiun tv lokal dibungkam nii anying"
2025-09-01 02:01:45+00:00,The list of bare minimums to do:
2025-09-01 03:05:47+00:00,#ResetIndonesia  Silakan dibaca ya pak/bu  @prabowo   @DPR_RI
2025-09-01 15:48:06+00:00,Love this pink and green power #ResetIndonesia
2025-08-31 18:32:37+00:00,"ini kalau pemerintah belum mengerti juga, saya juga angkat tangan dengan kebodohan yang ada."
2025-09-01 09:19:35+00:00,"Temen w bikin igs tentang tuntutan ini, ada temennya yg isilop reply kasih sop pengendalian massa  ga nyambung banget bgsd"
2025-09-01 02:54:06+00:00,i hope that what the President said in his yesterday Press Conference about inviting representatives to hold a public dialogue with the DPR will truly be conducted
2025-09-01 13:37:53+00:00,"sorry OOT, tiap liat warna pink sama ijo langsung kepikiran ""iguro san"""
2025-09-01 05:51:17+00:00,"masih terlalu general, kurang spesifik, dan perlu ada tuntutan tambahan. but its okay lah"
2025-09-01 06:41:06+00:00,Kurang apa si prabski di kasih problem solving segratis ini
2025-08-31 19:25:06+00:00,"GOKILL HASIL 3 JAM MEETING !!! kata gue mah orang DPR malu ih kerjanya tiap hari rapat2 pake fasilitas mewah gaji ga ngotak. kalah sama modal zoom meeting 3 jam doang, ga digaji lagi wkwk"
2025-08-31 17:00:55+00:00,I’d say this is a fair deadline.  Walk the Talk!
2025-08-31 17:17:09+00:00,"padahal rakyatnya sepinter ini, seluas ini idenya kalau mau musyawarah. malah milih naruh orang orang bodoh dikursi dpr"
2025-08-31 18:34:12+00:00,udh dibuatin to do listnya nih tinggal dilakuin aja sama petinggi petinggi itu. kurang enak apa lagi sihh
2025-09-01 06:35:02+00:00,"Kaum kaum boomer udah di rangkum nih, ga baca sih kebangetan"
2025-08-31 18:14:49+00:00,gua suka banget sama tone dan pemilihan warnanya  kudos buat designernya
2025-08-31 18:40:14+00:00,"udah dibreakdownin dan dibuat se-estetik mungkin biar nyaman bacanya, kalo sampe ga dibaca dan dilakuin si kelewatan bgt, mana isinya nih sbnrnya tuh bare minimum untuk menjadi penjabat dan aparat yg baik loh"
2025-09-01 04:51:40+00:00,i love how we use PINK for this time’s protest!! #ResetIndonesia
2025-09-01 01:16:56+00:00,when your people are more capable for handling this country than the president himself
2025-08-31 22:05:14+00:00,"After a week of provoking & inciting the people to ""revolt"" against the government & coordinating these protests, these are your demands?  These do not resolve the real problems, which are Western Imperialism & the Puppet Government they install.  @senjatanuklir   @BudiBukanIntel"
2025-09-01 11:37:13+00:00,pink really goes well with green.  #ResetIndonesia
2025-09-02 02:42:26+00:00,"Daaaan  Instead bikin tuntutan sampe 17+8 dan bikin puyeng bacanya di grassroot, bahkan untuk sesama oposisi X pun, kenapa ga bikin kek gini aj?  Ini versi gw ya. Dan mestinya masih bisa lebih ringkas lagi.  Barangkali yang lain punya versi ringkasnya sendiri. Feel free to add."
2025-09-02 02:14:24+00:00,bener sih
2025-09-02 03:00:13+00:00,Itu dieeeeeee knp 17+8 sih w jg kaya ??????
2025-09-02 02:43:57+00:00,Padahal generasi muda mestinya akrab dengan istilah 'tldr'
2025-09-02 01:28:13+00:00,"Setuju, kurang bisa sampai ke akar rumput, begitu pula dengan identitas gerakan seperti warna biru hijau pink itu, i mean sudah cukup bagus tapi semoga tidak berhenti jadi suatu yang performatif saja seperti liberal di barat sana.   Mungkin ya soal ""terlalu panjang dan susah"
2025-09-02 02:41:54+00:00,Agreed. Dibuat sama mereka yang kelamaan di menara gading sih.    Buruh-buruh kerah biru mana bisa hapal tuntutan sepanjang itu.   This breeds a crucial problem: Diseminasi ke akar rumput
2025-09-02 02:34:46+00:00,Hold up.....  There was a demand? (I legit missed that part)
2025-09-04 08:43:21+00:00,Influencer tuh gini!!! Thanks buat mereka yg punya akun gede mau ikut berisik menyuarakan aspirasi rakyat
2025-09-04 09:39:02+00:00,Sekalian pantengin website ini biar tau progres dari tiap tuntutannya    https:// bijakmemantau.id/tuntutan-178
2025-09-04 08:33:21+00:00,"Found a beautiful statement by Kak Abi. Setidaknya dengan adanya momentum ini walau perubahan dari pemerintah tidak sempurna, kita jadi berhasil bangkitin kemelekan masyarakat akan politik, sudah berhasil bangkitin keberanian untuk menyuarakan aspirasi, and that’s so true!"
2025-09-04 18:45:18+00:00,THIS!
2025-09-04 08:56:50+00:00,"Dengan ini semua sudah jelas ya. Tuntutan kami apa. Gak ada lagi tuduhan-tuduhan makar atau teror apalah. Gak ada lagi asumsi-asumsi.   Kalaupun ada dugaan ada yang menunggangi, silakan diusut. Tapi jangan tangkap sekutu kami. Bebaskan para aktivis dan mahasiswa."
2025-09-04 08:40:12+00:00,Ya meskipun artis tapi minimal ditemuin lah ya
2025-09-04 09:28:58+00:00,PANTAU TERUS
2025-09-04 08:11:57+00:00,"dh @dms_hrl · Sep 4 Quote Bareng Warga - #BebaskanKawanKami @barengwarga · Sep 4  KONFERENSI PERS TUNTUTAN 17+8   ""Kami tidak butuh nanti, kami tidak butuh janji, Kami ingin bukti konkret, kami ingin progress yang nyata, jadi kerjakan tuntutan tuntutan rakyat"" Abigail Muria.  ""Setiap nyawa yang hilang, setiap keluarga yang berduka, Setiap warga yang Show more 125"
2025-09-07 04:08:15+00:00,Chiaaa
2025-09-04 09:09:17+00:00,Insyaallah.
2025-09-04 10:15:05+00:00,DPR cuman muncul kalo artis yang udah turun kejalan soalnya takut citranya rusak ya kalo ga ketemu mereka? Miris
2025-09-04 08:52:13+00:00,SEMANGAT SEMUANYA!!!!
2025-09-04 14:16:40+00:00,Ini nih baru influencer keren
2025-09-04 08:31:15+00:00,CHIA!!!
2025-09-04 08:21:23+00:00,Ini potret selebgram dan influencer yg harus difollow dan jadiin contoh. Bukan yang- (lanjutin sendiri)  PENUHI TUNTUTAN 17+8 !!!! PENUHI TUNTUTAN 17+8 !!!! PENUHI TUNTUTAN 17+8 !!!! PENUHI TUNTUTAN 17+8 !!!!
2025-09-04 09:00:29+00:00,!!!!!!
2025-09-04 08:52:44+00:00,"Para dosen dan guru di mana aja, bikin survey kecil-kecilan yuk? Tanya-tanya, ajak ngobrol mahasiswa-siswa yang kalian ajar aja, misalnya ttg gimana persepsi dan sikap mereka ttg 17+8 ini"
2025-09-04 08:12:16+00:00,ngeliat kak  @bennysiauw89  bener gasi?
2025-09-04 11:32:59+00:00,"Yes, pertemuan perdana  @jerhemynemo   @ketendangs"
2025-09-04 11:16:03+00:00,"mey @3amfairytale · Sep 4 Quote Bareng Warga - #BebaskanKawanKami @barengwarga · Sep 4  KONFERENSI PERS TUNTUTAN 17+8   ""Kami tidak butuh nanti, kami tidak butuh janji, Kami ingin bukti konkret, kami ingin progress yang nyata, jadi kerjakan tuntutan tuntutan rakyat"" Abigail Muria.  ""Setiap nyawa yang hilang, setiap keluarga yang berduka, Setiap warga yang Show more 4"
2025-09-04 23:35:28+00:00,BANGGA BANGET COK SM PEREMPUAN PEREMPUAN INI
2025-09-04 15:00:10+00:00,"Ini influencer yang gue follow semua senengnya.. tp iya sih bener kenapa saat perumusan ga diinvite beberapa lembaga yang mewakili seluruh lapisan masyarakat tp tidak mengecilkan pergerakan mereka yang sampe begini sih bikin branding, bikin web. Segala gerakan berarti skrgk"
2025-09-04 08:27:01+00:00,"Abi, Andovi"
2025-09-04 13:22:52+00:00,KAK CIAAAAAA
2025-09-04 08:09:48+00:00,CHIA
2025-09-04 09:00:20+00:00,"Pashhh. @pepalacesh · Sep 4 Quote Bareng Warga - #BebaskanKawanKami @barengwarga · Sep 4  KONFERENSI PERS TUNTUTAN 17+8   ""Kami tidak butuh nanti, kami tidak butuh janji, Kami ingin bukti konkret, kami ingin progress yang nyata, jadi kerjakan tuntutan tuntutan rakyat"" Abigail Muria.  ""Setiap nyawa yang hilang, setiap keluarga yang berduka, Setiap warga yang Show more 31"
2025-09-04 09:10:11+00:00,"damn abigail limuria, the woman that you are"
2025-09-04 08:09:01+00:00,kittendust dan jerome akhirnya turun
2025-09-04 11:02:29+00:00,kak fathia omg
2025-09-05 10:23:16+00:00,CHIAAAAA
2025-09-05 00:46:32+00:00,LUCU BGT
2025-09-04 08:18:48+00:00,"Dari yang peduli isu lingkungan, pendidikan, hukum, politik, ekonomi sampai hubungan internasional ada semua........"
2025-09-04 09:16:41+00:00,"黒沢 アルト @aseroruu · Sep 4 Parody account Quote Bareng Warga - #BebaskanKawanKami @barengwarga · Sep 4  KONFERENSI PERS TUNTUTAN 17+8   ""Kami tidak butuh nanti, kami tidak butuh janji, Kami ingin bukti konkret, kami ingin progress yang nyata, jadi kerjakan tuntutan tuntutan rakyat"" Abigail Muria.  ""Setiap nyawa yang hilang, setiap keluarga yang berduka, Setiap warga yang Show more 66"
2025-09-04 08:40:59+00:00,Mari kawal bersama
2025-09-04 08:16:56+00:00,Terimakasih banyak kepada sudah mewakilkan  respect
2025-09-04 09:22:34+00:00,YESSSSS
2025-09-04 11:43:26+00:00,"nangis liat ini. mikirin gmn sebenernya dari awal yang kita butuhkan bukti nyata kalau aspirasi rakyat didengar, diterima, diskusi secara baik2, gak perlu ada kekerasan dari aparat dengan embel2 ""menjaga"". hari ini semua itu terbukti BISA dilakukan (dan lagi kalo MAU)"
2025-09-04 08:14:08+00:00,mantaappp
2025-09-04 12:38:30+00:00,Kak abiii
2025-09-04 09:32:26+00:00,"Spot Danu, PMK here"
2025-09-04 08:25:51+00:00,Sampai menang
2025-09-04 09:49:51+00:00,betul ini
2025-09-04 11:40:31+00:00,Jejak
2025-09-04 10:25:08+00:00,keren keren bat dah ni influencer
2025-09-04 11:55:18+00:00,MOTHERRR  @ketendangs
2025-09-04 16:19:40+00:00,Kak chia
2025-09-04 09:42:57+00:00,WE WON GUYS! KAWA TERUSSS
2025-09-04 15:37:50+00:00,"moon @yuoeenze · Sep 4 Quote Bareng Warga - #BebaskanKawanKami @barengwarga · Sep 4  KONFERENSI PERS TUNTUTAN 17+8   ""Kami tidak butuh nanti, kami tidak butuh janji, Kami ingin bukti konkret, kami ingin progress yang nyata, jadi kerjakan tuntutan tuntutan rakyat"" Abigail Muria.  ""Setiap nyawa yang hilang, setiap keluarga yang berduka, Setiap warga yang Show more 93"
2025-09-05 02:15:34+00:00,salut sekaligus respect bgt sama circle yg 1 ini
2025-09-04 10:54:20+00:00,"Tokoh-tokoh revolusioner dan aktor intelektual yang harus kita dukung guys!  Mereka ini representasi marsinah, hatta, munir, tan malaka, tjokroaminoto, dan kartini di tengah penindasan dan pembungkaman masyarakat oleh pemerintah."
2025-09-04 10:19:45+00:00,インドネシアの若い世代、頑張れ！！！
2025-09-04 10:38:51+00:00,rispeekk
2025-09-04 08:29:04+00:00,semoga kita mendapatkan kabar baik segera
2025-09-04 10:38:00+00:00,"sehat selalu orang"" baik, semoga dilindungi selalu sm Allah aamiin"
2025-09-04 09:08:53+00:00,Omg ada kak Fathia
2025-09-04 08:41:54+00:00,orang² pinter
2025-09-04 10:44:02+00:00,Kittendust
2025-09-04 15:42:17+00:00,Naksir bangett sama topi nya kak Abigail. Mau punyaa jugaaa
2025-09-04 08:34:07+00:00,Bang ferryyy
2025-09-04 11:45:27+00:00,"Gak berharap ...tapi ya bismillah, kawal terus."
2025-09-04 08:45:28+00:00,government sebegini sampis sampe warganya ngedikte hal yg perlu dilakuin. rasanya ini bukan lagi tuntutan karna kursi2 pemimpin yg rasanya didominasi penyandang intelektual
2025-09-04 09:34:45+00:00,KITEMDUSSSSS
2025-09-04 09:44:43+00:00,"EL @elkiveing · Sep 4 Quote Bareng Warga - #BebaskanKawanKami @barengwarga · Sep 4  KONFERENSI PERS TUNTUTAN 17+8   ""Kami tidak butuh nanti, kami tidak butuh janji, Kami ingin bukti konkret, kami ingin progress yang nyata, jadi kerjakan tuntutan tuntutan rakyat"" Abigail Muria.  ""Setiap nyawa yang hilang, setiap keluarga yang berduka, Setiap warga yang Show more 24"
2025-09-04 10:47:09+00:00,"Wahyu Setyawan @wahyustywnnn · Sep 4 Quote Bareng Warga - #BebaskanKawanKami @barengwarga · Sep 4  KONFERENSI PERS TUNTUTAN 17+8   ""Kami tidak butuh nanti, kami tidak butuh janji, Kami ingin bukti konkret, kami ingin progress yang nyata, jadi kerjakan tuntutan tuntutan rakyat"" Abigail Muria.  ""Setiap nyawa yang hilang, setiap keluarga yang berduka, Setiap warga yang Show more 11"
2025-09-04 09:24:22+00:00,Semoga malam baik nanti membuahkan hasil yang diminta masyarakat indonesia
2025-09-04 10:43:48+00:00,MOTHER IS MOTHERING
2025-09-04 14:26:58+00:00,"baru nonton fullnya, andovi gile"
2025-09-04 08:42:41+00:00,ILOVEYOU KAK CHIA
2025-09-04 09:01:57+00:00,mbakku masku <3
2025-09-04 08:09:29+00:00,Panjang umur dan sehat selalu!
2025-09-04 08:47:24+00:00,Semangat aka aka
2025-09-04 08:58:06+00:00,ga salah aku suka reality club
2025-09-04 08:39:20+00:00,"ada aja yg komen ""itu yg demo berarti anak abah ya? serius nanya"" gini ye, mau anak abah kek anak ganjar kek anak bapak emaknya kek yg penting BUKAN ANAK PENJILAT TAI WOWO dan BUKAN ANAK PERUSAK KONSTITUSI"
2025-09-04 10:14:54+00:00,mommyyy ciaa bestt
2025-09-04 08:35:24+00:00,GOOO CHIA GOOO
2025-09-04 08:07:55+00:00,JIR ADA MAMAHHH
2025-09-04 08:25:58+00:00,mamah chiaaas
2025-09-04 08:52:37+00:00,"Semoga backingan mereka kuat, stay safe semuanyaaaaa."
2025-09-04 08:24:38+00:00,Kereennn!!!!! Nangis merinding banget liatnya  semangat temen2
2025-09-04 09:56:54+00:00,Ini baru anak mudaarggghh
2025-09-04 13:10:44+00:00,LETS GOOO
2025-09-04 09:38:43+00:00,"KONFERENSI PERS TUNTUTAN 17+8   ""Kami tidak butuh nanti, kami tidak butuh janji, Kami ingin bukti konkret, kami ingin progress yang nyata, jadi kerjakan tuntutan tuntutan rakyat"" Abigail Muria.  ""Setiap nyawa yang hilang, setiap keluarga yang berduka, Setiap warga yang"
