created_at,full_text
2025-09-09 08:01:07+00:00,"Salut! Baru dilantik langsung berusaha keras, berusaha keras untuk melucu... tapi gagal. Akhirnya melanjutkan Kabinet Minta Maaf alias Kabinet Klarifikasi"
2025-09-09 09:40:35+00:00,"Sebenarnya ga ada yg diplintir, org ngomong langsung seperti itu kok ada disiaran lsgnya kok, setiap TV punya rekamannya"
2025-09-09 07:55:14+00:00,"mungkin dia pikir itu lucu, kata gw kerja aja yg bener kurangin ngomong aneh2nya rakyat lagi sensi"
2025-09-09 07:44:26+00:00,Ini bisa jadi target penjarahan lagi nih menteri baru  Ngomong ngalor ngidul ngelantur kaga jelas Masih kalah jauh dibawah bu sri banget banget ini mah
2025-09-09 08:25:00+00:00,"dih playvic abiiissssss, ""diplintir sana sini"" gakusah diplintir aja kata kata lu gakada empati pak, ""kalau ada kesalahan"" lu gaktau salah lu dimana?"
2025-09-09 09:35:01+00:00,Gini amat Pak  @prabowo   @Gerindra  milih menteri... Jgn milih...cuman pinter tapi yg punya ADAB juga Jgn suka nyakitin rakyat...krn Negara ini.. rakyat yg punya !!!
2025-09-09 07:39:31+00:00,"WKWKWKWKWKWKWKWKWKWKWKWKWKWK oh begini ya ternyata masuk pemerintah tuh syaratnya bukan minimal S1/S2, tapi minimal bisa asbun dan pandai ngejilat atasan"
2025-09-09 11:56:30+00:00,"Rakyat itu majikanmu, Pur... sekecil apapun suara mereka, kamu harus hormati dan jangan diremehkan, lakukan apapun yg kamu bisa, jangan songong..."
2025-09-10 00:45:40+00:00,"kasih vidio meneri keuangan Nepal ini nih, biar diatur mulutnya..."
2025-09-09 08:51:56+00:00,"Saya seneng dg gayanya bu Sri, idealis dan ber prinsip, sayangnya banyaknya keinginan dan kepentingan dari berbagai rezim saat dia menjabat, menjadikan dia.... Ah sudahlah.."
2025-09-09 09:30:18+00:00,"harus di ajarin adab, akhlak , tutur kata yang santun, sopan supaya ucapanya tidak melukai perasaan rakyat indonesia, bapak pejabat publik..ujung lidahnya harus di jaga"
2025-09-09 07:41:27+00:00,"Makanya pakkkk, mending ELU ngehire tim komunikasi publik atau PR team gitu. Biar tau cara ngomong yg tertata, bener, kaga bikin polemik ke masyarakat. Kaga asal jeplak mulut baru sadar bikin gaduh terus minta maaf."
2025-09-09 07:20:30+00:00,Ngomong yg penting  Yg penting ngomong
2025-09-09 07:36:20+00:00,Langsung mundur atau di ganti juga boleh wo  @prabowo   Mumpung dia belum gajian sebagai Menkeu Mumpung rumahnya belum di jarah masyarakat
2025-09-09 09:47:07+00:00,"Attitude yg tidak baik,kita lihat endingnya aja! Omongannya selangit kuatir lidahnya nyenggol baling2 helicopter"
2025-09-09 07:39:54+00:00,Takut rumah nya dijarah ye pak
2025-09-09 14:45:55+00:00,Begonoh katanyahhh...
2025-09-09 08:39:19+00:00,"@prabowo  pak.. Saya tahu anda ini penyintas stroke tapi ya masa pak, sampah kok bapak angkat jadi babu bapak??..."
2025-09-09 08:20:41+00:00,anak2 komunikasi PR harusnya punya banyak loker di kantor2 pemerintahan. jelas sekali itu kebutuhan SDM komunikasi PR sangat banyak dan urgent. krn masalah2 yg ditimbulkan sudah terpampang nyata.
2025-09-09 07:47:00+00:00,"Bro takut dikuliti 7 Turunan,  Bro takut digeruduk Rumah & Kantornya, Bro takut dipecat after 2 hari jd Menteri."
2025-09-09 12:13:35+00:00,"Pernyataan kontradiksi. Dia bilang tuntutan dari sebagian kecil rakyat, tapi fakta <6% itu mewakili dampak kemampuan ekonomi keseluruhan rakyat yg tertekan, dan mau dia naikkan. Tidak lebih sama kondisi kedepan.."
2025-09-09 13:35:07+00:00,Tuntutan nya sangat jelas 17+8  #CopotKapolri  #TurunkanGibran #AdiliJokowi
2025-09-09 11:45:42+00:00,LPS sebenarnya bisa disamakan dengan asuransi yang menjamin simpanan nasabah maks. 2 Milyar. LPS tidak ada beban kebijakan yang terkait dengan keuangan negara.   Wajar Menkeu yang baru demam panggung.
2025-09-09 13:42:41+00:00,"Seorang menteri kok diksinya seperti itu, gak ada wibawanya sama sekali. Keliatan jarang mikir, jadinya statement kemarin bisa keluar begitu aja"
2025-09-09 09:43:08+00:00,"Siklus pejabat di sini, jeplak dulu terus klarifikasi dan minta maaf.  Bisa tidak diam tidak banyak ngomong yang tidak perlu."
2025-09-09 14:35:57+00:00,Pertumbuhan ekonomi jaman Soeharto yg 7% saja di demo yg kemudian jatuh padahal tidak ada kelaparan ....
2025-09-09 10:54:10+00:00,"Model2an nya menang di gaya doang kyak nya.. klo pemain bola mondar mandir aja dlapangan, dpat bola kagak.. boro2 bs ngegolin.."
2025-09-09 10:22:54+00:00,Moap maap moap maap.....Ndasmu. Sak Gurungen Ngomong Koen Gak Mikir Disek Tah ?
2025-09-09 08:05:22+00:00,"Oh shuut, here we go again…"
2025-09-09 08:50:30+00:00,"pak itu ada teknologia namanya stand mic, gausah u pegangin terus terusan keliatan bgt gugupnya"
2025-09-09 07:20:33+00:00,bilangin bos lu  @KemenkeuRI
2025-09-09 09:27:20+00:00,"Siap-siap Bapak Presiden  @prabowo  dalam beberapa bulan ke depan pembantu bpk, Menkeu ini akan dikritik habis-habisan."
2025-09-09 14:03:44+00:00,"Ada Benarnya juga mentri yg baru ini, sebab keinginan terbesar rakyat Indonesia adalah adili jokowi dan termul termul yg merusak tatanan kehidupan berbangsa dan bernegara 10 tahun belakangan dibikin gak ada arah yg jelas.."
2025-09-09 10:16:08+00:00,"Heran dgn kualitas komunikasi publik ...   Hayoook... stlh 3 bln lg kita KRITIK kinerja org ini habis2an, jgn kasih kendor, jgn kasih NAFAS...  Sok jagoan sekali pejbt satu ini... Mirip opung LUHUT gayanya nih..."
2025-09-09 10:57:41+00:00,BELUM JUGA SEHARI MENJABAT DAH ERROR DAN BIKIN MAKAN HATI RAKYAT... BIASANYA YANG BANYAK GAYA DAN OMON GINI GA BAKAL LAMA DUDUK DI KURSI PANAS..
2025-09-09 22:17:46+00:00,"Yg nyorot menteri keuangan bukan cuman rakyat bro, seluruh dunia yg tertarik invest ke Indo nyorotin."
2025-09-09 08:21:57+00:00,Pak Purbaya.  Hati2.  Kata anakmu itu sebelahmu adalah agen CIA.
2025-09-09 07:44:17+00:00,"kata nya mau naikin pertumbuhan ekonomi s.d 8%, coba cek di pidato pisah sambut nya ini , ada kagak nyebut2 target pertumbuhan ekonomi 8% dan target langkah2 kebijakan konkrit nya mau ngapain ? NOL BESAR.. begitu udh dpt jabatan semua janji2nya dianulir.."
2025-09-09 08:25:06+00:00,Prediksi kamu  @grok  ekonomi di menteri yang baru gimana?
2025-09-09 13:43:17+00:00,Pertumbuhan 6% -  7% ...Mba Sri dalam hati ketawa terbahak2....
2025-09-09 10:05:39+00:00,puting lu gw plintir
2025-09-09 07:49:16+00:00,ketika jabatan menteri cuma asal cap cip cup kancing pak Presiden  @prabowo
2025-09-09 09:10:04+00:00,Bu Sri terlihat sinis melihat kelakuan songong penggantinya. Prediksi: semakin remuk!  @KemenkeuRI   @PurbayaYudhi
2025-09-09 07:31:48+00:00,Bu Sri aja yg ga ngomong aneh aneh malah diplintir eh ini malah nantangin
2025-09-09 20:18:14+00:00,Gesturnya itu lho ... . Gak usah ngomong pun sdh kelihatan to?
2025-09-09 21:00:19+00:00,Manusia ini akan menjadi mentri no 2 paling sombong setelah LBP kelak.
2025-09-09 07:50:56+00:00,"diplintir dari mana sih? org kalimatnya jelas begitu  terus lagi, ""kalo ada salah"", ya emang salah"
2025-09-09 08:04:32+00:00,Utk milih menteri aja kagetan. Gimana jdnya negara ini dipegang oleh org yg g ada persiapan?
2025-09-09 21:57:44+00:00,Iso ora sih pejabat nek ngomong ilat e ra kecetit teruss melukai hati rakyat
2025-09-09 07:45:59+00:00,"Plintir gimana, eloe yg ngmemg gitu,  klarifikasi nya malah menambah bullian & masalah pufft"
2025-09-10 02:48:54+00:00,"aduhh jgn dibiasain minta maaf deh wkwk males dengernya. udah kerja aja yg bener, apapun statement yg keluar dari mulut itu jgn asal dan harus bisa dipertanggungjawabkan, gitu aja. diketawain tuh sm srimul"
2025-09-09 07:44:58+00:00,((Bu Sri Mulyani hanya menahan senyum ala IYKYK))
2025-09-09 09:43:42+00:00,Lambemu mlintir..
2025-09-09 08:26:54+00:00,SIAPA YG MELINTIR ANJ
2025-09-09 10:05:18+00:00,"Sebelah mana dipelintir ya bos? Perasaanbitu cuplikan utuh pidato bapak, bukan potongan tiktok ala ala penggiringan opini"
2025-09-09 08:40:04+00:00,"Dikit dikit minta maaf, sekali kali mundur kalau ngerasa bikin salah,gentel gitu lho"
2025-09-09 11:16:32+00:00,Baru hitungan hari cakram Congor udh aus
2025-09-09 07:23:51+00:00,"iyadeh pak buktikan omongan anda dan lebih baik empati ditinggiin ya pak, rakyat indo skrg sedang tidak baik2 aja jd omongannya tolong di filter, anda pejabat jd mungkin lebih beretika dikit ya. di pelajari makanya gmn pola rakyat skrg, jgn meninggi, anda tuh digaji rakyat tau"
2025-09-10 05:37:57+00:00,masih dengan gaya nyalih orang... diplitir sana sini ..... Goblok dah
2025-09-09 23:46:56+00:00,Wajah2 pmuh ksombongan dan egoisnya klihtan bngt pa
2025-09-09 14:36:02+00:00,pencitraan doang lah jing muak
2025-09-09 15:48:28+00:00,"dr awal aja udh asbun, kedepannya makin hah sih ini"
2025-09-09 14:42:12+00:00,"Terkesan MENYEPELEKAN RAKYAT INDONESIA,.. dan TERLALU YAKIN DENGAN KEMAMPUAN,... Prediksi saya ga bakalan lama akan menuai BADAI SENDIRI,..  Kenapa ga lihat kondisi yaa ?  Saat ini Rakyat lagi Prihatin Pak,..  Jangan sembarangan berucap tanpa REM, terkesan BLONG !!!"
2025-09-09 09:17:54+00:00,Kecongkakan ala pejabatnya kelihatan..tidak mau mendengar suara rakyat...
2025-09-09 11:23:40+00:00,"Belum apa² sudah salah ngomong , meski benar tidak seharusnya di ucapkan"
2025-09-09 10:53:25+00:00,"Panik ni ye. Mic uda ada standmic, gausa dipegangin terus. Keliatan banget panik dan nervousnya wkwk"
2025-09-09 22:09:51+00:00,"menteri bisa ya kaya orang tolol begini, anjing banget auranya kaya idiot gitu wkwk"
2025-09-09 12:47:07+00:00,"Mau gaya koboi mau gaya preman sekalipun kalau jadi pejabat jaga tuh punya mulut, elo kan jadi pejabat publik skr!!!"
2025-09-09 16:17:44+00:00,Geblek
2025-09-10 01:13:46+00:00,“Dipelintir” brother those are the exact words coming out of your mouth lama2 gua pelintir tu congor ya
2025-09-09 11:35:07+00:00,Belum apa apa udh betingkah..wait and see aja
2025-09-09 15:03:16+00:00,"Liat kejadian kejadian sblmnya,, gmn statement para pejabat bikin gerah, marah masyarakat. Masak ngikut ngikut bicara tanpa pertimbangkan byk hal alias asal ngomong. Blunder jadinya.  Jangan mentang2 pejabat, ngomong seenak jidat"
2025-09-09 16:08:42+00:00,Ngeles lu
2025-09-09 10:12:18+00:00,Pler km kali di pelintir.  Yg km omongin jelas kata demi kata
2025-09-09 07:41:31+00:00,@mujaermundurr
2025-09-09 07:34:27+00:00,Pasti habis ditegur LetKol Teddy ya...
2025-09-09 12:07:52+00:00,cocot kobong
2025-09-09 08:18:43+00:00,Petantang petenteng bgt gayanya
2025-09-09 11:10:50+00:00,Belum sehari uda blunder… uda kaya Onana aja
2025-09-10 06:16:43+00:00,"Baru aje dilantik, udeh salah ngomong aje hadeh.. plintar plintir dikata gw budek kali yak"
2025-09-10 03:06:11+00:00,"Enak ya jadi menteri dan jajaran petinggi, tinggal minta maaf semua kelar (menurut dia)"
2025-09-09 13:33:58+00:00,"Klo belum mempelajari ya ngga usah kasih statement bilang itu suara sebagian kecil rakyat,pelajari lalu buktikan....buktikan klo lu bisa kerja buat rakyat bukan buat partai"
2025-09-09 13:24:51+00:00,Sp yg ngeplintir buset lu sendiri yg ngomong
2025-09-09 10:49:18+00:00,"Sakurunge pidato ki riset sek, Pak!"
2025-09-09 18:06:49+00:00,Sudah muak
2025-09-10 12:45:06+00:00,Tampang songong
2025-09-09 13:35:48+00:00,aya aya wae beliu ini.
2025-09-10 00:59:07+00:00,Harusnya belajar di John Robert Power dulu tuh Purbaya dan anaknya..belajar etiket dan public speaking.
2025-09-09 09:48:03+00:00,"Gaada yg pelintir idiot, astagfirullah"
2025-09-09 17:17:02+00:00,Petantang pententeng bngt gayanya
2025-09-09 11:23:39+00:00,"Siapa yang melintir, emang ucapanmu jelas kog. Lagian ,sibuk cari kerja itu jelas beda dengan sibuk kerja. Songong !!!!"
2025-09-09 10:54:17+00:00,Ngga sampe setahun keknya
2025-09-09 18:00:15+00:00,Kaya bapak2 tongkrongan ye
2025-09-10 14:08:53+00:00,Sepertinya belum pernah ikut penataran P4???
2025-09-10 03:58:10+00:00,jirrlah blm 24 jm
2025-09-09 14:45:45+00:00,Baru login langsung join asbun club
2025-09-09 14:50:10+00:00,DI LPS TIDAK MONITOR? LPS LOH
2025-09-09 09:18:35+00:00,Mulai oleng
2025-09-10 03:48:35+00:00,"YA MINTA MAAF AJE ANJWEEENKKkkK gapake “gaya saya gaya koboi”, koboi lu dilapangan bukan di kementrian"
2025-09-09 23:21:13+00:00,udah sadar kan sekarang kalo rakyat merhatiin gerak-gerik bapak ibuk semuaa
2025-09-09 13:55:52+00:00,Sombong aja dlu minta maaf belakangan
2025-09-09 13:05:25+00:00,"Wkwkk agak tengil ya pak, teknik abieezz. Btw coba kita lihat dulu guyss 1-2 th, karena ekonomi itu tidak semudah yg di lihat. Minimal 6-8% dulu lah   Ttaapii pak… karena netizen gampang tersinggung, belajar untuk berhati” nggih saat berbicara di publik"
2025-09-09 15:04:20+00:00,Hmmmm
2025-09-09 16:05:00+00:00,Hadehh kan ada aja kan tiap hari bikin ngucap istigfar.
2025-09-10 16:09:10+00:00,SM senyumny lepas sekali. Lega ya hilang beban di pundak itu.
2025-09-09 08:42:24+00:00,Sibuk Cari kerja bukan sibuk bekerja membagongkan emang
2025-09-10 01:50:28+00:00,"begini nih sirkelnya wowo, liat dari penampilannya aja udah berantakan, semoga kinerjanya engga dehhh"
2025-09-09 11:07:03+00:00,Purbaya hanya Penjilat dan pinter cari muka kasak kusuk sana sini ! Kemampuan kerja hanya MEMBUAL BAHASA JAWANYA NDOBOL JARAN COK !!!!!
2025-09-09 10:12:33+00:00,"Melihat gesture bicaranya tong kosong nyaring bunyinya, kalau ga berhasil nanti yang salah pasti Jokowi"
2025-09-09 14:20:44+00:00,Start menentukan finish
2025-09-10 12:15:47+00:00,"Yg lebih salah itu yg milih anda jadi Menkeu,org kagetan latah kok di pilih..."
2025-09-09 07:35:08+00:00,ga ada isinya yang di omong
2025-09-10 04:30:04+00:00,"Pantes indo jadi 10 negara tingkat literasi terendah plus IQ nya jongkok, ternyata emang se-darurat membaca ini pemimpin² negara ini"
2025-09-09 12:13:05+00:00,"Bisikan dr siapa si wooooo milih menteri kek gitu, hadeuuuh"
2025-09-09 08:46:17+00:00,Anda adalah tipikal karyawan yang kelakuannya seperti babi... tidak punya empati....11-12 dengan karyawan2 rakyat yang lain....
2025-09-09 11:32:10+00:00,"Megang mic udh kaya di karoekean, ini pidato apa stand up :(("
2025-09-09 13:27:43+00:00,"Ganti menteri bukannya malah makin maju, malah makin absurd"
2025-09-09 22:57:27+00:00,kek nya makin parah ini dari pada sri mulyani hahaa
2025-09-09 21:09:17+00:00,sombong dan congkak . dia akan jatuh dgn ucapannya
2025-09-09 07:48:19+00:00,"Mangkanya pak sebelum ngomong tuhhh dipikir duluuu, better diem sih than nyap2 terus minta maaf. Basi"
2025-09-09 09:10:02+00:00,Day 2 jadi mengtri
2025-09-10 03:49:12+00:00,Diplintir? Lagi2 rakyat yg di salahin pejabrut.
2025-09-09 13:55:11+00:00,"Indonesia rusak, dengan Metode Scorecard disalahgunakan.."
2025-09-10 01:55:35+00:00,"Koboi itu kerjaannya ngurus ternak,melindungi wilayah, adu jotos, minum alkohol dari buka mata sampe tutup mata bukan ngoceh serampangan ala ormas pasra induk!"
2025-09-10 01:53:12+00:00,"@MokaLokaMusic  gaya koboi katanya, belom aja lawan john dutton wkwkwkkw"
2025-09-09 09:15:14+00:00,"Tengil amat, kek uangnya halal ajaa.."
2025-09-09 09:43:24+00:00,Makin banyak ngomong. Makin banyak blunder nya.
2025-09-09 09:18:50+00:00,gatau ma baiknya nanya Pak
2025-09-09 08:10:02+00:00,maaf maaf mulu besok juga diulang lagi
2025-09-09 10:35:07+00:00,bruhhh wtf emg omongan lu yg nyulut emosi rakyat conggg wake tf up
2025-09-09 15:12:05+00:00,"Salah ngomong ya udah ngaku aja salah! Ga usah bilang diplintar plintir, masih aja nyalahin orang lain. Sok²an gaya koboi...hadeuh baru aja ngadepin anggota dpr songong, eh dapet yg ginian, blm jg sehari"
2025-09-09 08:40:45+00:00,Proker 1 : Minta maaf
2025-09-09 07:40:01+00:00,minta maaf tapi masih aja playing victim.  be gentle and humble man!
2025-09-09 14:35:52+00:00,Jangan melakukan kesalahan yang sama karena masih banyak kesalahan lain yang belum pernah dicoba.
2025-09-10 00:16:06+00:00,wkwkw ini kenapa pentingnya belajar political communication
2025-09-09 14:43:05+00:00,"Songong...nggak ada adab, tangan masuk ke kantong celana selagi pidato resmi di hadapan orang banyak..."
2025-09-09 14:07:43+00:00,Kudanya di iket dimana pak?
2025-09-09 09:23:26+00:00,jadi pejabat kerjanya cuma minta maaf... bukan kerja yang benerrr
2025-09-09 10:12:54+00:00,Sama aja sama anaknya. Blunder di IG. Sekeluarga koboi junior kayaknya
2025-09-09 16:16:26+00:00,Makin kesini makin kesana. Kaya kehabisan orang bener
2025-09-09 11:07:00+00:00,Sepertinya Menkeu ini sudah di planning buat diganti lagi..
2025-09-09 08:55:05+00:00,Diplintir?   Playvic
2025-09-09 16:18:09+00:00,Tanda2 makin sembraut dunia perpajakan negri ini
2025-09-09 09:22:35+00:00,kirain bakal beda.. ternyata sama aja.. asbun - minta maaf sekelas menteri kalo ngasi pernyataan kayak gak intelek sama sekali
2025-09-09 08:18:13+00:00,Udah  cocok dan langsung bisa beradaptasi dengan mentri2nya Prabski.
2025-09-09 09:46:46+00:00,Orang ini lebih berbahaya sepertinya
2025-09-09 07:35:48+00:00,Ape sih
2025-09-09 07:55:38+00:00,Kan bener minta maaf hahaha
2025-09-10 02:05:33+00:00,"Pur’ namanya pejabat publik, mau di monitor atau gak di monitor justru harusnya berperilaku baik & santun, kalo di monitor yaahh semua juga akan langsung memakai topeng, menunjukkan seolah dia malaikat pdhl aslinya setan!  apalagi Pur’ ente gak ada seujung kukunya ibu sri -"
2025-09-09 08:02:12+00:00,Lu aja yang tolol  @purbayayudhi
2025-09-09 07:16:27+00:00,Gaya saya - this old man need to read the room for sure
2025-09-09 08:57:12+00:00,ia tau ente orang teknik
2025-09-09 09:56:21+00:00,Make nih orang
2025-09-09 23:45:51+00:00,Petantang-petenteng banget yaolo  Bro pikir bro keren
2025-09-09 10:38:27+00:00,"The way he stand, hold the mic, and talk.."
2025-09-09 07:51:52+00:00,"pler lu diplintir jadi kupu2, nyet"
2025-09-09 08:20:34+00:00,Yang lama salah MASUK yang baru salah MEMASUKAN
2025-09-09 23:43:35+00:00,"Pak  @prabowo  ganti aja lagi, ledha ledhe gini mau jadi apa indonesia? Bacot doang gedhe ini mah modelannya"
2025-09-09 11:32:23+00:00,"Banyak omong banget, kita liat kinerjanya nanti"
2025-09-09 11:03:34+00:00,makin gelap dah ini mah..
2025-09-10 01:27:04+00:00,kek gini nih yg takutnya dibuang ke sungai spti menkeu nya Nepal kemaren
2025-09-09 10:27:19+00:00,Mentri-mentri lu gimana dah  @prabowo ? Kemaren kemenag sekarang kemenkeu
2025-09-09 11:27:53+00:00,Minta maaf tapi nuduh statementnya dipelintir! Wis ndologok!
2025-09-09 11:25:27+00:00,Sri mulyani awal pemerintahan Prabowo TDK tau rencana efisiensi anggaran
2025-09-09 10:45:19+00:00,Blm ape2 udeh sombong
2025-09-09 14:38:02+00:00,day 2 wis lekas okeh omonge
2025-09-09 10:36:06+00:00,Gestur nya aha dah keliatan kalau ga punya empati
2025-09-09 07:21:12+00:00,lah dia yang blak blakan ngomong kok bilang dipelintir dah wkwkwk
2025-09-09 16:35:19+00:00,"Gak lama kayaknya, blunder bs dr dia sendiri bs dr anak, gak belajar dr kesalahan pejabat yg sdh-sdh atau yg baru-baru ini aja."
2025-09-09 18:33:47+00:00,berbicara di forum resmi sambil tangan di dalam saku itu apa pantas  @PurbayaYudhi  ?
2025-09-09 13:23:10+00:00,Minimal mandi
2025-09-09 08:20:24+00:00,Tipikal bacot dulu pikir belakangan.
2025-09-10 17:19:20+00:00,"Jangan memaksa di""Nepal""kan oleh masyarakat yg kata lu itu sebagian kecil"
2025-09-09 09:26:24+00:00,"Gimana gak bikin Rakyat demo coba, lha omongan pejabatnya modelan kek gini."
2025-09-09 07:47:10+00:00,Day-2 bacot jd menteri
2025-09-09 07:55:59+00:00,gesture-nya.
2025-09-09 07:51:04+00:00,Baru day-2
2025-09-09 07:39:13+00:00,"Bukan diplintir su. kalo ngomong tuh yang bener, omongan lu itu diliat pasar su asuu"
2025-09-09 10:34:54+00:00,Perlu latihan publik speaking..  Atau mending andalkan humas saja..
2025-09-09 13:51:42+00:00,Kelihatan sekali seperti orang 'pintar' Kelihatannya!
2025-09-09 13:34:14+00:00,Jangan2 nih orang malah jadi beban Kemenkeu...
2025-09-09 10:51:01+00:00,Bu Sri lebih baik cuma 10 tahun lebih berada di tempat yang salah
2025-09-09 11:11:44+00:00,"Gak Bapaknya, gak anaknya. Keduanya mulutnya sama-sama lemes."
2025-09-10 01:34:43+00:00,"Ngeleees lagi. Siapa yang plintir omonganmu? Semua media mengutip total seluruh kalimat langsungnya. Tidak ada yang diplintir. Memang omonganmu yang salah, tidak empatik, tidak peka perasaan, arogan dan over-convidence. Persis niru Wowo, juragan barumu"
2025-09-09 10:29:23+00:00,Tanganya ngga bisa diem
2025-09-09 22:53:35+00:00,Hrusnya jgn ad tmpat tuk org2 sombong Klo w presidennya wlwpun bru dilantik trus ngomongnya sombong lgsung w pecat n cari org bru Demo2 kmren krn org2 sombong yg ga prnah nganggep rakyat ad mkanya kacau ni negara
2025-09-10 00:47:37+00:00,Makanya dipikir dl sblm mangap
2025-09-09 09:30:39+00:00,"Yah blm apa2 udah main plintir...jago juga nih barang, kalau ngeles"
2025-09-09 07:18:46+00:00,lulusan menara gading lambe ra ono filter
2025-09-09 11:24:17+00:00,Manusia Bedebah  Nir Empati  Yg merasakan lesunya Ekonomi bukan Sebiji dua biji Liat saja data BPS  Kelas menengah pun Turun Drastis
2025-09-10 06:49:31+00:00,"Udahlah emang kagak bener lu ye, asal ngomong tanpa mikir dlu. Emng etis seorang karyawan gtu ngomongnya? Sok mikir kl bisa, gausah klarifikasi mulu dah"
2025-09-10 18:08:39+00:00,heran knp jaman sekarang banyak pejabat tolol ya ..
2025-09-10 02:28:04+00:00,wkwkwk abis ditegor tuh
2025-09-09 10:17:47+00:00,Apanya diplintir.. songong betulan ituuu
2025-09-09 09:42:49+00:00,Parah ini
2025-09-09 07:33:17+00:00,jelek amat itu public speaknya anj
2025-09-10 11:56:13+00:00,Wowww...
2025-09-09 14:01:55+00:00,"Kemplitak iki wong, gak suwe gaak.."
2025-09-09 08:24:52+00:00,Udah blunder aja
2025-09-09 16:00:34+00:00,Cukup 1 kata : preeeeeeet
2025-09-09 09:37:15+00:00,Arogansi anak itb emang gini ya?
2025-09-09 09:10:11+00:00,Koboy jadi kasir negara? Waaah.....
2025-09-09 07:38:23+00:00,"Bisulan kali ini pejabat, makanya asal ceplos"
2025-09-10 04:03:58+00:00,"Makin banyak ngomong makin kliatan sisi jeleknya... Mendingan irit2 bicara,klo perlu pake jubir dah. Public speaking sejelek ini mendingan lebih banyak diam."
2025-09-09 08:05:47+00:00,"sukur lah minta maaf klo g, bisa kena reshuffle lagi ne org"
2025-09-09 10:54:17+00:00,Mesam mesem ngece yo Ibun
2025-09-09 07:55:31+00:00,Gak beres jg nih pengganti Bu Sri mulyani
2025-09-09 09:07:04+00:00,Makanya JAGA BIBIR!!!  Jangan asal ngecap aja TONG!!!  SOMBONG AMATTT...
2025-09-09 14:10:58+00:00,berasa lagi shooting jadi koboi apa gimana pak?
2025-09-09 10:36:35+00:00,Cocotnya perlu sekolah
2025-09-09 10:27:04+00:00,"gausa banyak omong om, buktiin aja lah kalo lu gawe yang bener"
2025-09-10 09:25:28+00:00,"tugas berat menanti anda, mencari duit yg banyak untuk menutup defisit APBN, bayar cicilan bunga utang, utang jatuh tempo dan biaya2 besar lainya, dgn catatan jgn mencari duitnya dengan cara menaikan tarif pajak dan utang..ISO..??"
2025-09-09 14:09:02+00:00,"Day 1 kuduna ulah langsung blunder, minimal ganti password wifi kantor."
2025-09-10 06:55:22+00:00,"Plintir palalu, emang elunya aja gak punya pikiran"
2025-09-09 07:31:25+00:00,Persiapan dikit wouldn't hurt pak
2025-09-10 00:21:30+00:00,Sampah masyarakat menjadi pejabat. Sudah saatnya rezim bobrok ini dibuang ke tempat sampah. Hanya menyusahkan rakyat  saja.
2025-09-09 14:00:43+00:00,"Belajar menunduk seperti padi lah, jangan merasa superior banget, lo tuh belum 24 jam diangkat sebagai menteri, jangan seenaknya. Rakyat ibarat kata lagi emosi trus disentil ya apa ga kesulut emosinya? Belajar dari kasus sahroni deh. Dah fokus kerja aja sana."
2025-09-09 11:23:42+00:00,wah barengan sm CIA
2025-09-09 17:13:37+00:00,"kelakuan setan gk pernah ngaku kalau setan, pasti salahin si manusia gk bisa tahan godaan"
2025-09-09 17:03:58+00:00,apanya yg diplintir? emang itu omonganmu bejir
2025-09-09 09:21:39+00:00,@kemenkeu   @KemenkeuRI  dipelintir ndasmu
2025-09-10 01:01:35+00:00,"Bapaknya nantangin warga, anaknya nuduh pendahulu bapaknya.  Bu Sri Mulyani, ngapain masih mau2an satu frame sama preman pasar modelan gitu? Eww"
2025-09-09 09:09:12+00:00,"dari bahasa tubuhnya dia tidak nyaman, pun juga kurang percaya diri."
2025-09-09 11:09:26+00:00,menkeu baru akan melaksanakan tugas dimulai dengan meralat ucapan  ucapan hasil dari kemampuan proses berpikir  dari meralat ucapan hasil pemikiran instan berpotensi akan melakukan suatu kesalahan  cekidot
2025-09-09 09:46:18+00:00,anak nya jg di ajarin jangan kurang ajar tuh
2025-09-09 13:27:05+00:00,"omongannya fakta padahal, liat aja kolom reply"
2025-09-10 00:01:23+00:00,"Minta maaf tapi bikin excuse. Nyalahin pihak lain. Siapa plintir ucapan situ? Itu bkn diplintir memang lu arogan. Org ga demo jika pemerintah kerja amanah dan profesional, hukum tegak."
2025-09-09 11:41:31+00:00,Ekspresi sri mul liat lah
2025-09-09 21:41:49+00:00,Orang pasar. Pasar senen atau pasar rebo?
2025-09-10 05:25:04+00:00,"Presiden Prabowo mengganti Bu Sri Mulyani dg image wanita pintar,keluarga yg humble.. DIGANTI dg seorang yg dlm hitungan hari sdh mengeluarkan statemen yg memanaskan kmbli emosi rakyat,dan juga sang anak dg congkak menunjukkan bagaimana org tuanya mendidiknya.."
2025-09-09 15:20:48+00:00,"Ini mah bukan koboi, tp org mabok di suruh kelola uang rakyat"
2025-09-10 03:48:34+00:00,Udah ga mau berharap apa2 sm konoha
2025-09-10 00:52:49+00:00,"""Di Sini, salah ngomong diplintir sana sini, saya mohon maaf,""  Gak niat minta maaf itu mah. Benar² menggambarkan ITB"
2025-09-09 23:10:18+00:00,"Ihh tololl nyeee....  Mana pelintir nye, emang lu asal jeplak aje...  Omongan pertama itu mh omongan jujur dari dalem.."
2025-09-10 02:59:31+00:00,"Saya acungi jempol atas sikap Gentleman nya, sdikit sekali pjbt aplgi setingkat mnteri yg berani meminta maaf, kecuali klu sdh berompi orange. Selamat bekerja pak menteri, lakukan perbaikan & tingkatkan kinerja kemenkeu kita. Smoga harapan ekonomi tumbuh 6-7 bhkn 8% bs di capai."
2025-09-09 14:09:50+00:00,Baru di lantik sdh minta maaf hahaaaaaaa Otak isi tai
2025-09-09 16:21:32+00:00,"Dari pejabat LPS diangkat jadi Menkeu sama kayak dari piguran diangkat jd aktor utama, kaget . Krn kaget dia merasa hebat merasa paling ahli, hingga songong takabur."
2025-09-09 23:35:25+00:00,"Baru mulai sudah buat gaduh,,, hadeuh..."
2025-09-09 12:26:15+00:00,"Sepertinya Bu SMI ngelirik sambil mikir, ""mampus lu! Gua udah merdeka, skrg gantian"""
2025-09-09 07:19:33+00:00,Buset ini orang public speaking nya ancur bgt
